{
  "$schema": "https://json-schema.org/draft/2020-12/schema",
  "$id": "https://companiondesktop.pet/schemas/persona-scheduler.schema.json",
  "title": "Companion Desktop Pet scheduler configuration",
  "type": "object",
  "required": [
    "$schema",
    "schema_version",
    "derived_from",
    "category_group_weights",
    "output_mode_targets",
    "runtime_limits",
    "context_tokens",
    "mvp_triggers",
    "future_triggers"
  ],
  "properties": {
    "$schema": { "const": "./schemas/persona-scheduler.schema.json" },
    "schema_version": { "const": 1 },
    "derived_from": { "$ref": "#/$defs/provenance" },
    "category_group_weights": { "$ref": "#/$defs/categoryGroupWeights" },
    "output_mode_targets": { "$ref": "#/$defs/outputModeWeights" },
    "runtime_limits": { "$ref": "#/$defs/runtimeLimits" },
    "context_tokens": { "$ref": "#/$defs/contextTokens" },
    "mvp_triggers": { "$ref": "#/$defs/mvpTriggers" },
    "future_triggers": { "$ref": "#/$defs/futureTriggers" }
  },
  "$defs": {
    "weight": { "type": "number", "minimum": 0, "maximum": 1 },
    "provenance": {
      "type": "object",
      "required": ["path", "schema_version", "sha256"],
      "properties": {
        "path": { "const": "config/persona-contract.json" },
        "schema_version": { "const": 1 },
        "sha256": { "type": "string", "pattern": "^[0-9a-f]{64}$" }
      },
      "additionalProperties": false
    },
    "categoryGroupWeights": {
      "type": "object",
      "required": [
        "technical",
        "growth",
        "career",
        "daily_care",
        "emotional_reflection",
        "character_life",
        "easter_egg",
        "system_ambient"
      ],
      "properties": {
        "technical": { "$ref": "#/$defs/weight" },
        "growth": { "$ref": "#/$defs/weight" },
        "career": { "$ref": "#/$defs/weight" },
        "daily_care": { "$ref": "#/$defs/weight" },
        "emotional_reflection": { "$ref": "#/$defs/weight" },
        "character_life": { "$ref": "#/$defs/weight" },
        "easter_egg": { "$ref": "#/$defs/weight" },
        "system_ambient": { "$ref": "#/$defs/weight" }
      },
      "additionalProperties": false
    },
    "outputModeWeights": {
      "type": "object",
      "required": ["self_talk", "ambient", "user_direct", "system_observe"],
      "properties": {
        "self_talk": { "$ref": "#/$defs/weight" },
        "ambient": { "$ref": "#/$defs/weight" },
        "user_direct": { "$ref": "#/$defs/weight" },
        "system_observe": { "$ref": "#/$defs/weight" }
      },
      "additionalProperties": false
    },
    "runtimeLimits": {
      "type": "object",
      "required": [
        "minimum_interval_minutes",
        "max_outputs_per_hour",
        "late_night_max_outputs_per_hour",
        "semantic_group_no_repeat",
        "block_adjacent_category_groups",
        "technical_recent_window",
        "technical_recent_max",
        "user_direct_recent_window",
        "user_direct_recent_max",
        "easter_egg_recent_window",
        "easter_egg_recent_max",
        "long_silence_minutes",
        "interrupt_cost_minimum_intervals_minutes"
      ],
      "properties": {
        "minimum_interval_minutes": { "type": "integer", "minimum": 1 },
        "max_outputs_per_hour": { "type": "integer", "minimum": 1 },
        "late_night_max_outputs_per_hour": { "type": "integer", "minimum": 0 },
        "semantic_group_no_repeat": { "type": "boolean" },
        "block_adjacent_category_groups": {
          "type": "array",
          "items": { "$ref": "#/$defs/categoryGroup" },
          "minItems": 1,
          "uniqueItems": true
        },
        "technical_recent_window": { "type": "integer", "minimum": 1 },
        "technical_recent_max": { "type": "integer", "minimum": 0 },
        "user_direct_recent_window": { "type": "integer", "minimum": 1 },
        "user_direct_recent_max": { "type": "integer", "minimum": 0 },
        "easter_egg_recent_window": { "type": "integer", "minimum": 1 },
        "easter_egg_recent_max": { "type": "integer", "minimum": 0 },
        "long_silence_minutes": { "type": "integer", "minimum": 1 },
        "interrupt_cost_minimum_intervals_minutes": {
          "type": "object",
          "required": ["0", "1", "2", "3", "4", "5"],
          "properties": {
            "0": { "type": "integer", "minimum": 1 },
            "1": { "type": "integer", "minimum": 1 },
            "2": { "type": "integer", "minimum": 1 },
            "3": { "type": "integer", "minimum": 1 },
            "4": { "type": "integer", "minimum": 1 },
            "5": { "type": "integer", "minimum": 1 }
          },
          "additionalProperties": false
        }
      },
      "additionalProperties": false
    },
    "categoryGroup": {
      "enum": [
        "technical",
        "growth",
        "career",
        "daily_care",
        "emotional_reflection",
        "character_life",
        "easter_egg",
        "system_ambient"
      ]
    },
    "contextTokens": {
      "type": "array",
      "items": {
        "enum": [
          "none", "app_started", "holiday", "anniversary", "ide_foreground",
          "active_90m", "idle_return", "not_fullscreen", "day:weekday",
          "day:weekend", "time:dawn", "time:morning", "time:noon",
          "time:afternoon", "time:evening", "time:late_night", "season:spring",
          "season:summer", "season:autumn", "season:winter", "date:holiday",
          "date:month_boundary"
        ]
      },
      "minItems": 22,
      "maxItems": 22,
      "uniqueItems": true
    },
    "mvpTriggers": {
      "type": "array",
      "items": {
        "enum": [
          "any", "app_start", "morning", "noon", "afternoon", "evening",
          "late_night", "day_changed", "weekday", "weekend", "holiday",
          "anniversary", "long_silence"
        ]
      },
      "minItems": 13,
      "maxItems": 13,
      "uniqueItems": true
    },
    "futureTriggers": {
      "type": "array",
      "items": { "enum": ["ide_foreground", "long_active", "idle_return", "story_timer"] },
      "minItems": 4,
      "maxItems": 4,
      "uniqueItems": true
    }
  },
  "additionalProperties": false
}
